{
  "artifact": "ising_hamiltonian",
  "artifact_schema_version": "1.0",
  "circuit_scale": 1.5,
  "circuit_scale_note": "QAOA uses H / max|coefficient|; eigenvectors and their order are unchanged",
  "fixture": "scenario_a_feasible",
  "generator": {
    "milestone": "M3",
    "name": "qplace",
    "version": "0.1.0"
  },
  "ising": {
    "J": [
      {
        "coefficient": "3/2",
        "i": 0,
        "j": 1
      },
      {
        "coefficient": "3/2",
        "i": 2,
        "j": 3
      },
      {
        "coefficient": "3/2",
        "i": 4,
        "j": 5
      }
    ],
    "convention": "z_i = 1 - 2 x_i; Pauli label qubit 0 = rightmost character",
    "h": [
      {
        "coefficient": "-1/1",
        "i": 0
      },
      {
        "coefficient": "-1/1",
        "i": 1
      },
      {
        "coefficient": "-1/1",
        "i": 2
      },
      {
        "coefficient": "-1/1",
        "i": 3
      },
      {
        "coefficient": "-1/1",
        "i": 4
      },
      {
        "coefficient": "-1/1",
        "i": 5
      }
    ],
    "num_qubits": 6,
    "offset": "3/2",
    "pauli_terms": [
      {
        "coefficient": -1.0,
        "label": "IIIIIZ"
      },
      {
        "coefficient": -1.0,
        "label": "IIIIZI"
      },
      {
        "coefficient": -1.0,
        "label": "IIIZII"
      },
      {
        "coefficient": -1.0,
        "label": "IIZIII"
      },
      {
        "coefficient": -1.0,
        "label": "IZIIII"
      },
      {
        "coefficient": -1.0,
        "label": "ZIIIII"
      },
      {
        "coefficient": 1.5,
        "label": "IIIIZZ"
      },
      {
        "coefficient": 1.5,
        "label": "IIZZII"
      },
      {
        "coefficient": 1.5,
        "label": "ZZIIII"
      }
    ]
  },
  "source": {
    "snapshot_id": "m2-scenario-a-feasible",
    "source_sha256": "c63654c225a1f1ae508046a1f8cde3275e886e82ccc9ba1eafeb51c2a657db47"
  },
  "status": "SUPPORTED",
  "target_node": "worker-03"
}
