{
  "artifact": "ising_hamiltonian",
  "artifact_schema_version": "1.0",
  "circuit_scale": 0.5,
  "circuit_scale_note": "QAOA uses H / max|coefficient|; eigenvectors and their order are unchanged",
  "fixture": "scenario_e_uncertain",
  "generator": {
    "milestone": "M3",
    "name": "qplace",
    "version": "0.1.0"
  },
  "ising": {
    "J": [
      {
        "coefficient": "1/2",
        "i": 0,
        "j": 1
      }
    ],
    "convention": "z_i = 1 - 2 x_i; Pauli label qubit 0 = rightmost character",
    "h": [],
    "num_qubits": 2,
    "offset": "-1/2",
    "pauli_terms": [
      {
        "coefficient": 0.5,
        "label": "ZZ"
      }
    ]
  },
  "source": {
    "snapshot_id": "m2-scenario-e-uncertain",
    "source_sha256": "1d1932678fdda115a06e567d4e9438d17485779fe24a5ded9e0f11fc0c24140f"
  },
  "status": "SUPPORTED",
  "target_node": "source"
}
